"targets","layer","layer_old","name","description","fld_value","units","path_in","path_in_exists","filename","path_out"
"AO","ao_access","rn_ao_access","Fisheries management effectiveness and opportunity","The opportunity for artisanal and recreational fishing based on the quality of management of the small- scale fishing sector (Mora et al 2009)","value","value","//neptune.nceas.ucsb.edu/data_edit/model/GL-NCEAS-Resilience_v2013a/data/r_mora_s4_2013a.csv",TRUE,"ao_access.csv","eez2013/layers/ao_access.csv"
"AO","ao_need","rny_ao_need","Purchasing power parity as a proxy for subsistence fishing need, by region","The per capita purchasing power parity (PPP) adjusted gross domestic product (GDP): GDPpcPPP","value","value","../ohiprep/Global/WorldBank-Statistics_v2012/data/rgn_wb_gdppcppp_rescaled_2013a.csv",TRUE,"ao_need.csv","eez2013/layers/ao_need.csv"
"CW","cw_coastalpopn_trend","rn_cw_coastalpopn_trend","Coastal human population as a proxy for trend in trash","Coastal population, defined as the total population inland of 25 miles ","trend","trend score","//neptune.nceas.ucsb.edu/data_edit/model/GL-NCEAS-CoastalPopulation_v2013/data/rgn_popn5yrtrend_inland25mi_2008to2013.csv",TRUE,"cw_coastalpopn_trend.csv","eez2013/layers/cw_coastalpopn_trend.csv"
"CW","cw_fertilizer_trend","rn_cw_fertilizer_trend","Fertilizer consumption as a proxy for trend in nutrient pollution","Statistics on fertilizer consumption from the Food and Agricultural Organization (FAO) ","trend.score","trend score","//neptune.nceas.ucsb.edu/data_edit/model/GL-NCEAS_CW_trends_v2013a/data/GL-NCEAS_CW_Fertilizers_trend_v2013a.csv",TRUE,"cw_fertilizer_trend.csv","eez2013/layers/cw_fertilizer_trend.csv"
"CW","cw_pathogen_trend","rn_cw_pathogen_trend","Trends in access to improved sanitation as a proxy for pathogen pollution trend","Trends in percent of population with access to improved sanitation facilities","trend","trend score","../ohiprep/Global/WHOUNICEF-Sanitation_v2012/data/pathogens_popdensity25km_trend_2013a.csv",TRUE,"cw_pathogen_trend.csv","eez2013/layers/cw_pathogen_trend.csv"
"CW","cw_pesticide_trend","rn_cw_pesticide_trend","Pesticide consumption as a proxy for trend in chemical pollution","Statistics on pesticides consumption from the Food and Agricultural Organization (FAO) ","trend.score","trend score","//neptune.nceas.ucsb.edu/data_edit/model/GL-NCEAS_CW_trends_v2013a/data/GL-NCEAS_CW_Pesticides_trend_v2013a.csv",TRUE,"cw_pesticide_trend.csv","eez2013/layers/cw_pesticide_trend.csv"
"FIS","fis_b_bmsy","fnk_fis_b_bmsy","B/Bmsy estimates obtained using the catch-MSY method",,"b_bmsy","B / B_msy","//neptune.nceas.ucsb.edu/data_edit/model/GL-NCEAS_FIS_v2013a/RevisingFIS/data//fnk_fis_b_bmsy_lyr.csv",TRUE,"fis_b_bmsy.csv","eez2013/layers/fis_b_bmsy.csv"
"FIS","fis_meancatch","snk_fis_meancatch","Catch data for each Taxon/FAO/SAUP region averaged across years (1980-2011)","Reported data includes years 2006-2011","mean_catch","metric tons","//neptune.nceas.ucsb.edu/data_edit/model/GL-NCEAS_FIS_v2013a/RevisingFIS/data//snk_fis_meancatch_lyr.csv",TRUE,"fis_meancatch.csv","eez2013/layers/fis_meancatch.csv"
"FIS","fis_proparea_saup2rgn","snk_fis_proparea_saup2rgn","area of each saup/total OHI reporting region","For converting saup regions to OHI reporting regions","prop_area","proportion of area","//neptune.nceas.ucsb.edu/data_edit/model/GL-NCEAS_FIS_v2013a/RevisingFIS/data//snk_fis_proparea_saup2rgn_lyr.csv",TRUE,"fis_proparea_saup2rgn.csv","eez2013/layers/fis_proparea_saup2rgn.csv"
"FP","fp_wildcaught_weight","rn_fp_wildcaught_weight","Fisheries weighting factor","Proportional yield of wild caught fisheries","w_fis","value","//neptune.nceas.ucsb.edu/data_edit/model/GL-NCEAS_FIS_v2013a/GL_FP_wildcaught_weight_v2013a_lyr.csv",TRUE,"fp_wildcaught_weight.csv","eez2013/layers/fp_wildcaught_weight.csv"
"HAB CS CP","hab_extent","rnk_hab_extent","Habitat extent","Modeled combined habitat extent","km2","km^2","//neptune.nceas.ucsb.edu/data_edit/model/GL-NCEAS-Habitats_v2013a/data/hab_habtitat_extent_NewSeaIce.csv",TRUE,"hab_extent.csv","eez2013/layers/hab_extent.csv"
"HAB CS CP","hab_health","rnk_hab_health","Habitat health","Modeled combined habitat health condition trend","health","value","//neptune.nceas.ucsb.edu/data_edit/model/GL-NCEAS-Habitats_v2013a/data/hab_habitat_health.csv",TRUE,"hab_health.csv","eez2013/layers/hab_health.csv"
"HAB CS CP","hab_trend","rnk_hab_trend","Habitat health trend","Modeled combined habitat health trend","trend","trend score","//neptune.nceas.ucsb.edu/data_edit/model/GL-NCEAS-Habitats_v2013a/data/hab_habitat_trend.csv",TRUE,"hab_trend.csv","eez2013/layers/hab_trend.csv"
"ICO","ico_spp_extinction_status","rnk_ico_spp_extinction_status","IUCN extinction risk category for iconic species","International Union for Conservation of Nature (IUCN) Red List threat categories with aggregated species lists ","category","category","//neptune.nceas.ucsb.edu/data_edit/model/GL-NCEAS-IconicSpecies_v2013/data/ico_spp_extinction_status.csv",TRUE,"ico_spp_extinction_status.csv","eez2013/layers/ico_spp_extinction_status.csv"
"ICO","ico_spp_popn_trend","rnk_ico_spp_popn_trend","IUCN population trend as a proxy for iconic species trend","International Union for Conservation of Nature (IUCN) Red List threat categories with aggregated species lists ","popn_trend","trend score","//neptune.nceas.ucsb.edu/data_edit/model/GL-NCEAS-IconicSpecies_v2013/data/ico_spp_popn_trend.csv",TRUE,"ico_spp_popn_trend.csv","eez2013/layers/ico_spp_popn_trend.csv"
"LE","le_gdp",,"GDP","gapfilled","usd","2010 USD","../ohiprep/Global/NCEAS-Livelihoods_v2013/data/le_gdp.csv",TRUE,"le_gdp.csv","eez2013/layers/le_gdp.csv"
"LE","le_gdp_pc_ppp","le_gdp_pc_ppp","Modeled Livelihoods & Economies data","gross domestic product per person at purchasing power parity","usd","USD","../ohiprep/Global/NCEAS-Livelihoods_v2013/data/le_cntry_gdp_pc_ppp_2013a.csv",TRUE,"le_gdp_pc_ppp.csv","eez2013/layers/le_gdp_pc_ppp.csv"
"LE","le_jobs_cur_adj_value","le_jobs_cur_adj_value","Modeled Livelihoods & Economies data","One of current or reference and base or adjusted value","value","value","../ohiprep/Global/NCEAS-Livelihoods_v2013/data/le_2013_status_model_curref_jobs_cur_adj_value.csv",TRUE,"le_jobs_cur_adj_value.csv","eez2013/layers/le_jobs_cur_adj_value.csv"
"LE","le_jobs_cur_base_value","le_jobs_cur_base_value","Modeled Livelihoods & Economies data","One of current or reference and base or adjusted value","value","value","../ohiprep/Global/NCEAS-Livelihoods_v2013/data/le_2013_status_model_curref_jobs_cur_base_value.csv",TRUE,"le_jobs_cur_base_value.csv","eez2013/layers/le_jobs_cur_base_value.csv"
"LE","le_jobs_ref_adj_value","le_jobs_ref_adj_value","Modeled Livelihoods & Economies data","One of current or reference and base or adjusted value","value","value","../ohiprep/Global/NCEAS-Livelihoods_v2013/data/le_2013_status_model_curref_jobs_ref_adj_value.csv",TRUE,"le_jobs_ref_adj_value.csv","eez2013/layers/le_jobs_ref_adj_value.csv"
"LE","le_jobs_ref_base_value","le_jobs_ref_base_value","Modeled Livelihoods & Economies data","One of current or reference and base or adjusted value","value","value","../ohiprep/Global/NCEAS-Livelihoods_v2013/data/le_2013_status_model_curref_jobs_ref_base_value.csv",TRUE,"le_jobs_ref_base_value.csv","eez2013/layers/le_jobs_ref_base_value.csv"
"LE","le_jobs_sector_year",,"Jobs","gapfilled","value","jobs","../ohiprep/Global/NCEAS-Livelihoods_v2013/data/le_eez2013_trend_jobs_sector-year.csv",TRUE,"le_jobs_sector_year.csv","eez2013/layers/le_jobs_sector_year.csv"
"LE","le_rev_cur_adj_value","le_rev_cur_adj_value","Modeled Livelihoods & Economies data","One of current or reference and base or adjusted value","value","value","../ohiprep/Global/NCEAS-Livelihoods_v2013/data/le_2013_status_model_curref_rev_cur_adj_value.csv",TRUE,"le_rev_cur_adj_value.csv","eez2013/layers/le_rev_cur_adj_value.csv"
"LE","le_rev_cur_base_value","le_rev_cur_base_value","Modeled Livelihoods & Economies data","One of current or reference and base or adjusted value","value","value","../ohiprep/Global/NCEAS-Livelihoods_v2013/data/le_2013_status_model_curref_rev_cur_base_value.csv",TRUE,"le_rev_cur_base_value.csv","eez2013/layers/le_rev_cur_base_value.csv"
"LE","le_rev_ref_adj_value","le_rev_ref_adj_value","Modeled Livelihoods & Economies data","One of current or reference and base or adjusted value","value","value","../ohiprep/Global/NCEAS-Livelihoods_v2013/data/le_2013_status_model_curref_rev_ref_adj_value.csv",TRUE,"le_rev_ref_adj_value.csv","eez2013/layers/le_rev_ref_adj_value.csv"
"LE","le_rev_ref_base_value","le_rev_ref_base_value","Modeled Livelihoods & Economies data","One of current or reference and base or adjusted value","value","value","../ohiprep/Global/NCEAS-Livelihoods_v2013/data/le_2013_status_model_curref_rev_ref_base_value.csv",TRUE,"le_rev_ref_base_value.csv","eez2013/layers/le_rev_ref_base_value.csv"
"LE","le_rev_sector_year",,"Revenue","gapfilled","value","2010 USD","../ohiprep/Global/NCEAS-Livelihoods_v2013/data/le_eez2013_trend_rev_sector-year.csv",TRUE,"le_rev_sector_year.csv","eez2013/layers/le_rev_sector_year.csv"
"LE","le_revenue_adj","le_revenue_adj","Modeled Livelihoods & Economies data","adjusted revenue","usd","USD","../ohiprep/Global/NCEAS-Livelihoods_v2013/data/le_revenue_adj.csv",TRUE,"le_revenue_adj.csv","eez2013/layers/le_revenue_adj.csv"
"LE","le_unemployment",,"Unemployment","gapfilled","percent","percent unemployed","../ohiprep/Global/NCEAS-Livelihoods_v2013/data/le_unemployment.csv",TRUE,"le_unemployment.csv","eez2013/layers/le_unemployment.csv"
"LE","le_wage_cur_adj_value","le_wage_cur_adj_value","Modeled Livelihoods & Economies data","One of current or reference and base or adjusted value","value","value","../ohiprep/Global/NCEAS-Livelihoods_v2013/data/le_2013_status_model_curref_wage_cur_adj_value.csv",TRUE,"le_wage_cur_adj_value.csv","eez2013/layers/le_wage_cur_adj_value.csv"
"LE","le_wage_cur_base_value","le_wage_cur_base_value","Modeled Livelihoods & Economies data","One of current or reference and base or adjusted value","value","value","../ohiprep/Global/NCEAS-Livelihoods_v2013/data/le_2013_status_model_curref_wage_cur_base_value.csv",TRUE,"le_wage_cur_base_value.csv","eez2013/layers/le_wage_cur_base_value.csv"
"LE","le_wage_ref_adj_value","le_wage_ref_adj_value","Modeled Livelihoods & Economies data","One of current or reference and base or adjusted value","value","value","../ohiprep/Global/NCEAS-Livelihoods_v2013/data/le_2013_status_model_curref_wage_ref_adj_value.csv",TRUE,"le_wage_ref_adj_value.csv","eez2013/layers/le_wage_ref_adj_value.csv"
"LE","le_wage_ref_base_value","le_wage_ref_base_value","Modeled Livelihoods & Economies data","One of current or reference and base or adjusted value","value","value","../ohiprep/Global/NCEAS-Livelihoods_v2013/data/le_2013_status_model_curref_wage_ref_base_value.csv",TRUE,"le_wage_ref_base_value.csv","eez2013/layers/le_wage_ref_base_value.csv"
"LE","le_wage_sector_year",,"Wages","gapfilled","value","2010 USD","../ohiprep/Global/NCEAS-Livelihoods_v2013/data/le_eez2013_trend_wage_sector-year.csv",TRUE,"le_wage_sector_year.csv","eez2013/layers/le_wage_sector_year.csv"
"LE","le_workforcesize_adj","le_workforcesize_adj","Modeled Livelihoods & Economies data","adjusted workforce size","jobs","jobs","../ohiprep/Global/NCEAS-Livelihoods_v2013/data/le_workforcesize_adj.csv",TRUE,"le_workforcesize_adj.csv","eez2013/layers/le_workforcesize_adj.csv"
"LE pressures","le_sector_weight","rnk_le_sector_weight","Jobs weighting","Jobs weighting by sector (defaulting to 1)","weight","value","//neptune.nceas.ucsb.edu/data_edit/model/GL-NCEAS-Pressures_v2013a/data/le_sector_weight_disaggregateNature2012b.csv",TRUE,"le_sector_weight.csv","eez2013/layers/le_sector_weight.csv"
"LIV ECO","le_popn","rny_le_popn","Total population by subregion","Population data from The World Bank","count","count","//neptune.nceas.ucsb.edu/data_edit/model/GL-WorldBank-Statistics_v2012/data/rgn_wb_pop_2013a_updated.csv",TRUE,"le_popn.csv","eez2013/layers/le_popn.csv"
"LIV ECO","liveco_status","rn_liveco_status","Modeled livelihoods and economies status","Modeled livelihoods and economies status based on new approach","value","status score","//neptune.nceas.ucsb.edu/data_edit/model/GL-NCEAS-LayersDisaggregated_v2013a/data/rgn_liv.eco_status_2013a.csv",TRUE,"liveco_status.csv","eez2013/layers/liveco_status.csv"
"LIV ECO","liveco_trend","rn_liveco_trend","Modeled livelihoods and economies trend","Modeled livelihoods and economies trend based on new approach","value","trend score","//neptune.nceas.ucsb.edu/data_edit/model/GL-NCEAS-LayersDisaggregated_v2013a/data/rgn_liv.eco_trend_2013a.csv",TRUE,"liveco_trend.csv","eez2013/layers/liveco_trend.csv"
"LSP","lsp_prot_area_inland1km","rny_lsp_prot_area_inland1km","Coastal protected areas inland 1km","Coastal protected areas inland to 1km","area_km2","km^2","//neptune.nceas.ucsb.edu/data_edit/model/GL-WDPA-MPA_v2013/data/lsp_prot_area_inland1km.csv",TRUE,"lsp_prot_area_inland1km.csv","eez2013/layers/lsp_prot_area_inland1km.csv"
"LSP","lsp_prot_area_offshore3nm","rny_lsp_prot_area_offshore3nm","Coastal marine protected areas offshore 3km","Coastal marine protected areas offshore to 3nm","area_km2","km^2","//neptune.nceas.ucsb.edu/data_edit/model/GL-WDPA-MPA_v2013/data/lsp_prot_area_offshore3nmb.csv",TRUE,"lsp_prot_area_offshore3nm.csv","eez2013/layers/lsp_prot_area_offshore3nm.csv"
"MAR","mar_coastalpopn_inland25mi","mar_coastalpopn_inland25mi","Coastal population inland 25 miles","Coastal population inland 25 miles by year (2005-2015)","popsum","people","//neptune.nceas.ucsb.edu/data_edit/model/GL-NCEAS-CoastalPopulation_v2013/data/rgn_popsum2005to2015_inland25mi.csv",TRUE,"mar_coastalpopn_inland25mi.csv","eez2013/layers/mar_coastalpopn_inland25mi.csv"
"MAR","mar_harvest_species","mar_harvest_species","Mariculture species harvested",,"species","species name","//neptune.nceas.ucsb.edu/data_edit/model/GL-NCEAS_MAR_v2013a/Revision_Dec202013/mar_harvest_species_lyr.csv",TRUE,"mar_harvest_species.csv","eez2013/layers/mar_harvest_species.csv"
"MAR","mar_harvest_tonnes","mar_harvest_tonnes","Mariculture harvest","Mariculture harvest by species and year","tonnes","tons","//neptune.nceas.ucsb.edu/data_edit/model/GL-NCEAS_MAR_v2013a/Revision_Dec202013/MAR_harvest_tonnes_lyr.csv",TRUE,"mar_harvest_tonnes.csv","eez2013/layers/mar_harvest_tonnes.csv"
"MAR","mar_sustainability_score","mar_sustainability_score","Mariculture sustainability score","Mariculture sustainability score by species","sust_coeff","sustainability","//neptune.nceas.ucsb.edu/data_edit/model/GL-NCEAS_MAR_v2013a/Revision_Dec202013/mar_sustainability_score_lyr.csv",TRUE,"mar_sustainability_score.csv","eez2013/layers/mar_sustainability_score.csv"
"MAR","mar_trend_years","mar_trend_years","Mariculter years used for trend",,"trend_yrs","year string","//neptune.nceas.ucsb.edu/data_edit/model/GL-NCEAS_MAR_v2013a/Revision_Dec202013/mar_trend_years_lyr.csv",TRUE,"mar_trend_years.csv","eez2013/layers/mar_trend_years.csv"
"NP","np_blast",,"Areas of observed blast (dynamite) fishing",,"score","pressure score","../ohiprep/Global/WRI-ReefsAtRisk_v2013/data/gl_thr_blast_3nm_rgn2013.csv",TRUE,"np_blast.csv","eez2013/layers/np_blast.csv"
"NP","np_cyanide",,"Areas of observed poison fishing",,"score","pressure score","../ohiprep/Global/WRI-ReefsAtRisk_v2013/data/gl_thr_poison_3nm_rgn2013.csv",TRUE,"np_cyanide.csv","eez2013/layers/np_cyanide.csv"
"NP","np_harvest_product_weight",,"Ratio of product peak harvest value (in 2010 USD) divided by sum of all product peak harvest values, per region",,"weight","score","../ohiprep/Global/FAO-Commodities_v2011/data/np_harvest_usd_product-peak_eez2013-year-max-2009_buffer-0.35.csv",TRUE,"np_harvest_product_weight.csv","eez2013/layers/np_harvest_product_weight.csv"
"NP","np_harvest_tonnes","rnky_np_harvest_relative","Harvest yield of marine natural products, smoothed","Yield in metric tonnes of six marine products (coral, fish oil, seaweed and plants, shells, sponges, ornamental fish)","tonnes","metric tonnes","../ohiprep/Global/FAO-Commodities_v2011/data/np_harvest_tonnes_eez2013-year-max-2009_buffer-0.35.csv",TRUE,"np_harvest_tonnes.csv","eez2013/layers/np_harvest_tonnes.csv"
"NP","np_harvest_tonnes_relative","rnky_np_harvest_relative","Harvest ratio to peak yeild of marine natural products","Ratio to max yield (tons) of product peak for six marine products (coral, fish oil, seaweed and plants, shells, sponges, ornamental fish)","tonnes_rel","score","../ohiprep/Global/FAO-Commodities_v2011/data/np_harvest_tonnes-rel_eez2013-year-max-2009_buffer-0.35.csv",TRUE,"np_harvest_tonnes_relative.csv","eez2013/layers/np_harvest_tonnes_relative.csv"
"NP","np_harvest_usd","rnky_np_harvest_relative","Harvest value of marine natural products, smoothed","Value in 2010 US dollars of six marine products (coral, fish oil, seaweed and plants, shells, sponges, ornamental fish)","usd","2010 USD","../ohiprep/Global/FAO-Commodities_v2011/data/np_harvest_usd_eez2013-year-max-2009_buffer-0.35.csv",TRUE,"np_harvest_usd.csv","eez2013/layers/np_harvest_usd.csv"
"NP","np_harvest_usd_relative","rnky_np_harvest_relative","Harvest ratio to peak value of marine natural products","Ratio to max value (2010 USD) of product peak of six marine products (coral, fish oil, seaweed and plants, shells, sponges, ornamental fish)","usd_rel","score","../ohiprep/Global/FAO-Commodities_v2011/data/np_harvest_usd-rel_eez2013-year-max-2009_buffer-0.35.csv",TRUE,"np_harvest_usd_relative.csv","eez2013/layers/np_harvest_usd_relative.csv"
"SPP","spp_status","rn_spp_status","Species lists and IUCN threat categories as a proxy for iconic species status","International Union for Conservation of Nature (IUCN) Red List threat categories with aggregated species lists ","score","status score","//neptune.nceas.ucsb.edu/data_edit/model/GL-NCEAS-SpeciesDiversity_v2013a/data/rgn_spp_score_2013.csv",TRUE,"spp_status.csv","eez2013/layers/spp_status.csv"
"SPP","spp_trend","rn_spp_trend","Species lists and IUCN threat categories as a proxy for iconic species trend","International Union for Conservation of Nature (IUCN) Red List threat categories with aggregated species lists ","score","trend score","//neptune.nceas.ucsb.edu/data_edit/model/GL-NCEAS-SpeciesDiversity_v2013a/data/rgn_spp_trend_2013.csv",TRUE,"spp_trend.csv","eez2013/layers/spp_trend.csv"
"TR","tr_jobs_total","tr_jobs_total","Total labor force",,"count","jobs","../ohiprep/Global/WorldBank-Statistics_v2012/data//rgn_wb_tlf_2014a_ratio-gapfilled.csv",TRUE,"tr_jobs_total.csv","eez2013/layers/tr_jobs_total.csv"
"TR","tr_jobs_tourism","tr_jobs_tourism","Direct employment in tourism",,"count","jobs","../ohiprep/Global/WTTC-Tourism_v2013/data//rgn_wttc_empd_2014a.csv",TRUE,"tr_jobs_tourism.csv","eez2013/layers/tr_jobs_tourism.csv"
"TR","tr_sustainability","tr_sustainability","Sustainability index","Tourism Competitiveness Index (TTCI) from the World Economic Forum","score","score","//neptune.nceas.ucsb.edu/data_edit/model/GL-WEF-Economics_v2013/data/rgn_wef_ttci_2013a_lyr.csv",TRUE,"tr_sustainability.csv","eez2013/layers/tr_sustainability.csv"
"TR","tr_unemployment","tr_unemployment","Percent unemployment",,"percent","percent unemployed","../ohiprep/Global/WorldBank-Statistics_v2012/data//rgn_wb_uem_2014a_ratio-gapfilled.csv",TRUE,"tr_unemployment.csv","eez2013/layers/tr_unemployment.csv"
"pressures","cc_acid","cc_acid","Ocean acidification","Modeled distribution of the aragonite saturation state (AAS) of the ocean in pre-industrial (~1870) and modern times (2000-2009) from Halpern et al. 2008","pressure_score","pressure score","//neptune.nceas.ucsb.edu/data_edit/model/GL-NCEAS-Pressures_v2013a/data/cc_acid_2013_NEW.csv",TRUE,"cc_acid.csv","eez2013/layers/cc_acid.csv"
"pressures","cc_slr","cc_slr","Sea level rise","Modeled sea level rise after Halpern et al. 2008","pressure_score","pressure score","//neptune.nceas.ucsb.edu/data_edit/model/GL-NCEAS-Pressures_v2013a/data/cc_slr_2013_NEW.csv",TRUE,"cc_slr.csv","eez2013/layers/cc_slr.csv"
"pressures","cc_sst","cc_sst","Sea surface temperature (SST) anomalies","Modeled sea level rise after Halpern et al. 2008","pressure_score","pressure score","//neptune.nceas.ucsb.edu/data_edit/model/GL-NCEAS-Pressures_v2013a/data/cc_sst_2013_NEW.csv",TRUE,"cc_sst.csv","eez2013/layers/cc_sst.csv"
"pressures","cc_uv","cc_uv","UV radiation","Modeled UV radiation after Halpern et al. 2008","pressure_score","pressure score","//neptune.nceas.ucsb.edu/data_edit/model/GL-NCEAS-Pressures_v2013a/data/cc_uv_2013_NEW.csv",TRUE,"cc_uv.csv","eez2013/layers/cc_uv.csv"
"pressures","fp_art_hb","fp_art_hb","High bycatch caused by artisanal fishing ","The presence of destructive artisanal blast and poison (cyanide) fishing","pressures.score","pressure score","//neptune.nceas.ucsb.edu/data_edit/model/GL-NCEAS-Pressures_v2013a/data/p_fp_art_hb_disaggregateNature2012.csv",TRUE,"fp_art_hb.csv","eez2013/layers/fp_art_hb.csv"
"pressures","fp_art_lb","fp_art_lb","Low bycatch caused by artisanal fishing ","Statistics of low bycatch artisanal fishing using non-destructive practices","pressure_score","pressure score","//neptune.nceas.ucsb.edu/data_edit/model/GL-NCEAS-Pressures_v2013a/data/fp_art_lb_2013_NEW.csv",TRUE,"fp_art_lb.csv","eez2013/layers/fp_art_lb.csv"
"pressures","fp_com_hb","fp_com_hb","High bycatch caused by commercial fishing ","Statistics of destructive commercial fishing practices by 5 different gear types (developed in Halpern et al. 2008)","pressure_score","pressure score","//neptune.nceas.ucsb.edu/data_edit/model/GL-NCEAS-Pressures_v2013a/data/fp_com_hb_2013_NEW.csv",TRUE,"fp_com_hb.csv","eez2013/layers/fp_com_hb.csv"
"pressures","fp_com_lb","fp_com_lb","Low bycatch caused by commercial fishing ","Statistics of least destructive commercial fishing practices by 2 different gear types (developed in Halpern et al. 2008)","pressure_score","pressure score","//neptune.nceas.ucsb.edu/data_edit/model/GL-NCEAS-Pressures_v2013a/data/fp_com_lb_2013_NEW.csv",TRUE,"fp_com_lb.csv","eez2013/layers/fp_com_lb.csv"
"pressures","fp_targetharvest","fp_targetharvest","Targeted harvest of cetaceans and sea turtles","Targeted harvest of cetaceans and marine turtles, from Food and Agricultural Organization data","score","pressure score","../ohiprep/Global/FAO-TargetedHarvest_v2012/data/rgn_fao_targeted_2013a.csv",TRUE,"fp_targetharvest.csv","eez2013/layers/fp_targetharvest.csv"
"pressures","hd_intertidal","hd_intertidal","Coastal population density as a proxy for intertidal habitat destruction","Coastal population density within 10 km of the coast","pressure_score","pressure score","//neptune.nceas.ucsb.edu/data_edit/model/GL-NCEAS-Pressures_v2013a/data/hd_intertidal_2013_NEW.csv",TRUE,"hd_intertidal.csv","eez2013/layers/hd_intertidal.csv"
"pressures","hd_subtidal_hb","hd_subtidal_hb","High bycatch artisanal fishing practices as a proxy for subtidal hard bottom habitat destruction","The presence of destructive artisanal blast and poison (cyanide) fishing","value","pressure score","//neptune.nceas.ucsb.edu/data_edit/model/GL-NCEAS-Pressures_v2013a/data/p_hd_subtidal_hb_v2013a.csv",TRUE,"hd_subtidal_hb.csv","eez2013/layers/hd_subtidal_hb.csv"
"pressures","hd_subtidal_sb","hd_subtidal_sb","High bycatch commercial fishing practices as a proxy for subtidal soft bottom habitat destruction","Spatially distributed commercial catch data by fishing gear type, developed by Sea Around Us Project","pressures.score","pressure score","//neptune.nceas.ucsb.edu/data_edit/model/GL-NCEAS-subtidal_softbottom_v2013a/data/po_rgn_hd_subtidal_sb_2013a.csv",TRUE,"hd_subtidal_sb.csv","eez2013/layers/hd_subtidal_sb.csv"
"pressures","po_chemicals_3nm","po_chemicals_3nm","Land-based chemical pollution","Land-based organic pollution at 1km2 resolution (as developed in Halpern et al. 2008)","pressure_score","pressure score","//neptune.nceas.ucsb.edu/data_edit/model/GL-NCEAS-Pressures_v2013a/data/po_chemicals_3nm_2013_NEW.csv",TRUE,"po_chemicals_3nm.csv","eez2013/layers/po_chemicals_3nm.csv"
"pressures","po_nutrients_3nm","po_nutrients_3nm","Coastal nutrient pollution","Modeled coastal nutrient pollution based on Halpern et al. 2008","pressure_score","pressure score","//neptune.nceas.ucsb.edu/data_edit/model/GL-NCEAS-Pressures_v2013a/data/po_nutrients_3nm_2013_NEW.csv",TRUE,"po_nutrients_3nm.csv","eez2013/layers/po_nutrients_3nm.csv"
"pressures","sp_alien","sp_alien","Alien species","The number and type of invasive and harmful invasive species in each marine ecoregion","pressures.score","pressure score","//neptune.nceas.ucsb.edu/data_edit/model/GL-NCEAS-Pressures_v2013a/data/p_sp_alien_2013a.csv",TRUE,"sp_alien.csv","eez2013/layers/sp_alien.csv"
"pressures","sp_genetic","sp_genetic","Introduced species as a proxy for genetic escapes ","Statistics on native or introduced species from the Mariculture Sustainibility Index (MSI)","pressures.score","pressure score","//neptune.nceas.ucsb.edu/data_edit/model/GL-NCEAS-Pressures-GenEsc_v2013a/data/GenEsc_v2013a.csv",TRUE,"sp_genetic.csv","eez2013/layers/sp_genetic.csv"
"pressures","ss_wgi","ss_wgi","Weakness of governance indicated with the WGI","Inverse of World Governance Indicators (WGI) six combined scores","score","pressure score","../ohiprep/Global/WorldBank-WGI_v2013/data/rgn_wb_wgi_2013a_inverse.csv",TRUE,"ss_wgi.csv","eez2013/layers/ss_wgi.csv"
"pressures CP","cp_habitat_extent_rank","rnk_cp_habitat_extent_rank","Habitat extent * rank, per Coastal Protection habitats","Habitat extent * habitat rank for Coastal Protection habitats: coral, mangrove offshore 1km, mangrove inland 1km, saltmarsh, seaice_shoreline and seagrass","extent_rank","rank","//neptune.nceas.ucsb.edu/data_edit/model/GL-NCEAS-Habitats_v2013a/data/cp_habitat_extent_rank.csv",TRUE,"cp_habitat_extent_rank.csv","eez2013/layers/cp_habitat_extent_rank.csv"
