"targets","layer","name","description","fld_value","units","path_in","path_in_exists","filename","path_out"
"resilience","species_diversity_3nm","Measure of coastal ecological integrity","Marine species condition (results from species subgoal)  calculated within 3 nm of shoreline as a proxy for ecological integrity","score","scaled 0-1","../ohiprep/globalprep/spp_ico/v2016/output/spp_status_3nm.csv",TRUE,"species_diversity_3nm.csv","eez2015/layers/species_diversity_3nm.csv"
"resilience","species_diversity_eez","Measure of ecological integrity","Marine species condition (results from species subgoal) as a proxy for ecological integrity","score","scaled 0-1","../ohiprep/globalprep/spp_ico/v2016/output/spp_status_global.csv",TRUE,"species_diversity_eez.csv","eez2015/layers/species_diversity_eez.csv"
"resilience","wgi_all","Strength of governance","World Governance Indicators (WGI) six combined scores","resilience_score","scaled 0-1","../ohiprep/globalprep/prs_res_wgi/v2016/output/wgi_res_2015.csv",TRUE,"wgi_all.csv","eez2015/layers/wgi_all.csv"
"spatial","cntry_rgn","ISO country codes","Lookup table of country codes (based on ISO 3166 country codes) and Ocean Health Index region idenifiers.","rgn_id","region id","../ohiprep/globalprep/spatial/v2013/cntry_rgn_2013.csv",TRUE,"cntry_rgn.csv","eez2015/layers/cntry_rgn.csv"
"spatial","rgn_area","Region areas based on EEZ boundaries","Area of Ocean Health Index regions modified from exclusive economic zones ","area_km2","km2","../ohiprep/globalprep/spatial/v2015/data/rgn_fao_gcs_area.csv",TRUE,"rgn_area.csv","eez2015/layers/rgn_area.csv"
"spatial","rgn_georegions","UN geopolitical region classifications","Lookup table of Ocean Health Index regions and UN geopolitical regions (3 levels), often used for gapfilling missing data","georgn_id","UN regions","../ohiprep/globalprep/spatial/v2013/rgn_georegions_long_2013b.csv",TRUE,"rgn_georegions.csv","eez2015/layers/rgn_georegions.csv"
"spatial","rgn_global","OHI regions","Subset of regions that are not deleted or disputed ","label","label","../ohiprep/globalprep/spatial/v2013/rgn_global.csv",TRUE,"rgn_global.csv","eez2015/layers/rgn_global.csv"
"spatial","rgn_labels","Regions ","Regions by type (eez, subocean, unclaimed)","label","label","../ohiprep/globalprep/spatial/v2013/rgn_labels.csv",TRUE,"rgn_labels.csv","eez2015/layers/rgn_labels.csv"
"SPP","spp_status","Average species condition","Species condition based on average of IUCN threat categories","score","status score","../ohiprep/globalprep/spp_ico/v2016/output/spp_status_global.csv",TRUE,"spp_status.csv","eez2015/layers/spp_status.csv"
"SPP","spp_trend","Average species trends","Species trends based on average of IUCN population trend data","score","trend score","../ohiprep/globalprep/spp_ico/v2016/output/spp_trend_global.csv",TRUE,"spp_trend.csv","eez2015/layers/spp_trend.csv"
"TR","tr_jobs_pct_tourism","Percent direct employment in tourism","Percent direct employment in tourism","Ep","proportion","../ohiprep/globalprep/tr/v2016/output/tr_jobs_pct_tourism.csv",TRUE,"tr_jobs_pct_tourism.csv","eez2015/layers/tr_jobs_pct_tourism.csv"
"TR","tr_sustainability","Tourism sustainability index","Tourism Competitiveness Index (TTCI)","S_score","score","../ohiprep/globalprep/tr/v2015/data/tr_sustainability.csv",TRUE,"tr_sustainability.csv","eez2015/layers/tr_sustainability.csv"
"TR","tr_travelwarnings","US State Department travel warnings","Countries with US State Department travel warnings","multiplier","score","../ohiprep/globalprep/tr/v2016/output/tr_travelwarnings.csv",TRUE,"tr_travelwarnings.csv","eez2015/layers/tr_travelwarnings.csv"
