"targets","layer","name","description","fld_value","units","path_in","path_in_exists","filename","path_out"
"AO","ao_access","Fisheries management effectiveness and opportunity","The opportunity for artisanal and recreational fishing based on the quality of management of the small-scale fishing sector","value","scaled 0-1","../ohiprep/globalprep/res_mora_ao/v2013/data/r_mora_s4_2013a.csv",TRUE,"ao_access.csv","eez2015/layers/ao_access.csv"
"AO","ao_need","Purchasing power parity as a proxy for subsistence fishing need","The per capita purchasing power parity (PPP) adjusted gross domestic product (GDP): GDPpcPPP","value","scaled 0-1","../ohiprep/globalprep/ao/v2016/output/wb_gdppcppp_rescaled.csv",TRUE,"ao_need.csv","eez2015/layers/ao_need.csv"
"CP CS HAB","hab_extent","Habitat extent","Area of habitats: mangrove, saltmarsh, seagrass, soft-bottom, seaice, coral","km2","km2","../ohiprep/globalprep/hab_combined/v2016/output/habitat_extent_v2015.csv",TRUE,"hab_extent.csv","eez2015/layers/hab_extent.csv"
"CP CS HAB","hab_health","Habitat condition","Current condition of habitat relative to historical condition","health","proportion","../ohiprep/globalprep/hab_combined/v2016/output/habitat_health_2015.csv",TRUE,"hab_health.csv","eez2015/layers/hab_health.csv"
"CP CS HAB","hab_trend","Habitat condition trend","Estimated change in habitat condition during most recent 5 years","trend","trend","../ohiprep/globalprep/hab_combined/v2016/output/habitat_trend_2015.csv",TRUE,"hab_trend.csv","eez2015/layers/hab_trend.csv"
"CW","cw_chemical_trend","Chemical pollution trend","Modeled chemical pollution from commercial shipping traffic, ports and harbors, and pesticide use","trend","trend","../ohiprep/globalprep/prs_chem/v2016/output/cw_chemical_trend_2015_new.csv",TRUE,"cw_chemical_trend.csv","eez2015/layers/cw_chemical_trend.csv"
"CW","cw_nutrient_trend","Nutrient pollution trend","Modeled data based on fertilizer consumption as a proxy for nutrient pollution","trend","trend","../ohiprep/globalprep/prs_land-based_nutrient/v2016/output/cw_fertilizers_trend_2015_new.csv",TRUE,"cw_nutrient_trend.csv","eez2015/layers/cw_nutrient_trend.csv"
"CW","cw_pathogen_trend","Pathogen pollution trend","Trends in percent of population without access to improved sanitation facilities as a proxy for pathogen pollution","trend","trend","../ohiprep/globalprep/prs_cw_pathogen/v2016/output/pathogens_popdensity25mi_trend_2015a.csv",TRUE,"cw_pathogen_trend.csv","eez2015/layers/cw_pathogen_trend.csv"
"CW","cw_trash_trend","Plastic trash trends","Trends in trash estimated using improperly disposed of plastics","trend","trend","../ohiprep/globalprep/cw_trend_trash/v2016/output//cw_trash_trend.csv",TRUE,"cw_trash_trend.csv","eez2015/layers/cw_trash_trend.csv"
"CW pressures","po_chemicals_3nm","Coastal chemical pollution","Modeled chemical pollution from commercial shipping traffic, ports and harbors, and pesticide use","pressure_score","scaled 0-1","../ohiprep/globalprep/prs_chem/v2015/output/cw_chemical_score_3nm_2015.csv",TRUE,"po_chemicals_3nm.csv","eez2015/layers/po_chemicals_3nm.csv"
"CW pressures","po_nutrients_3nm","Coastal nutrient pollution","Modeled data based on fertilizer consumption from the Food and Agricultural Organization","pressure_score","scaled 0-1","../ohiprep/globalprep/prs_land-based_nutrient/v2015/output/cw_fertilizers_score_3nm_2015.csv",TRUE,"po_nutrients_3nm.csv","eez2015/layers/po_nutrients_3nm.csv"
"CW pressures","po_pathogens","Pathogen pollution","Percent of population without access to improved sanitation facilities as a proxy for pathogen pollution","pressure_score","scaled 0-1","../ohiprep/globalprep/prs_cw_pathogen/v2015/data/po_pathogens_popdensity25mi_2015a.csv",TRUE,"po_pathogens.csv","eez2015/layers/po_pathogens.csv"
"CW pressures","po_trash","Marine plastics","Global marine plastics","pressure_score","scaled 0-1","../ohiprep/globalprep/cw_pressure_trash/v2015/output/trash_eez_2015.csv",TRUE,"po_trash.csv","eez2015/layers/po_trash.csv"
"ECO LIV","le_popn","Total population","Population of the OHI region","count","number of people","../ohiprep/globalprep/le_world_bank/v2013/data/rgn_wb_pop_2013a_updated.csv",TRUE,"le_popn.csv","eez2015/layers/le_popn.csv"
"FIS","fis_b_bmsy","B/Bmsy estimates obtained using RAM data (when available) and the catch-MSY method","The ratio of fish population abundance compared to the abundance required to deliver maximum sustainable yield","bbmsy","B/Bmsy","../ohiprep/globalprep/fis/v2016/data/fis_bbmsy.csv",TRUE,"fis_b_bmsy.csv","eez2015/layers/fis_b_bmsy.csv"
"FIS","fis_meancatch","Fishery catch data","Mean commercial catch for each OHI region (averaged across years) ","mean_catch","tonnes","../ohiprep/globalprep/fis/v2016/data/mean_catch.csv",TRUE,"fis_meancatch.csv","eez2015/layers/fis_meancatch.csv"
"FP","fp_wildcaught_weight","Food provision weights","Proportion of wild caught fisheries to mariculture","w_fis","proportion","../ohiprep/globalprep/fp/v2016/output/wildcaught_weight_v2015.csv",TRUE,"fp_wildcaught_weight.csv","eez2015/layers/fp_wildcaught_weight.csv"
"ICO","ico_spp_iucn_status","IUCN extinction risk","IUCN extinction risk category for iconic species located within each region","category","IUCN risk category","../ohiprep/globalprep/spp_ico/v2016/output/ico_spp_iucn_status.csv",TRUE,"ico_spp_iucn_status.csv","eez2015/layers/ico_spp_iucn_status.csv"
"LE","le_gdp","GDP","Gross Domestic Product (GDP)","usd","2012 USD","../ohiprep/globalprep/le/v2013/data/le_gdp.csv",TRUE,"le_gdp.csv","eez2015/layers/le_gdp.csv"
"LE","le_gdp_pc_ppp","GDP per capita PPP","Gross domestic product per person at purchasing power parity","usd","USD","../ohiprep/globalprep/le/v2013/data/le_cntry_gdp_pc_ppp_2013a.csv",TRUE,"le_gdp_pc_ppp.csv","eez2015/layers/le_gdp_pc_ppp.csv"
"LE","le_jobs_cur_adj_value","Current jobs adjusted","Modeled LE data","value","value","../ohiprep/globalprep/le/v2013/data/le_2013_status_model_curref_jobs_cur_adj_value.csv",TRUE,"le_jobs_cur_adj_value.csv","eez2015/layers/le_jobs_cur_adj_value.csv"
"LE","le_jobs_cur_base_value","Current jobs base","Modeled LE data","value","value","../ohiprep/globalprep/le/v2013/data/le_2013_status_model_curref_jobs_cur_base_value.csv",TRUE,"le_jobs_cur_base_value.csv","eez2015/layers/le_jobs_cur_base_value.csv"
"LE","le_jobs_ref_adj_value","Reference jobs adjusted","Modeled LE data","value","value","../ohiprep/globalprep/le/v2013/data/le_2013_status_model_curref_jobs_ref_adj_value.csv",TRUE,"le_jobs_ref_adj_value.csv","eez2015/layers/le_jobs_ref_adj_value.csv"
"LE","le_jobs_ref_base_value","Reference jobs base","Modeled LE data","value","value","../ohiprep/globalprep/le/v2013/data/le_2013_status_model_curref_jobs_ref_base_value.csv",TRUE,"le_jobs_ref_base_value.csv","eez2015/layers/le_jobs_ref_base_value.csv"
"LE","le_jobs_sector_year","Jobs","Modeled LE data","value","number of jobs","../ohiprep/globalprep/le/v2013/data/le_eez2013_trend_jobs_sector-year.csv",TRUE,"le_jobs_sector_year.csv","eez2015/layers/le_jobs_sector_year.csv"
"LE","le_rev_cur_adj_value","Current revenue adjusted","Modeled LE data","value","value","../ohiprep/globalprep/le/v2013/data/le_2013_status_model_curref_rev_cur_adj_value.csv",TRUE,"le_rev_cur_adj_value.csv","eez2015/layers/le_rev_cur_adj_value.csv"
"LE","le_rev_cur_base_value","Current revenue base","Modeled LE data","value","value","../ohiprep/globalprep/le/v2013/data/le_2013_status_model_curref_rev_cur_base_value.csv",TRUE,"le_rev_cur_base_value.csv","eez2015/layers/le_rev_cur_base_value.csv"
"LE","le_revenue_adj","Revenue adjusted","Modeled LE data","usd","USD","../ohiprep/globalprep/le/v2013/data/le_revenue_adj.csv",TRUE,"le_revenue_adj.csv","eez2015/layers/le_revenue_adj.csv"
"LE","le_rev_ref_adj_value","Reference revenue adjusted","Modeled LE data","value","value","../ohiprep/globalprep/le/v2013/data/le_2013_status_model_curref_rev_ref_adj_value.csv",TRUE,"le_rev_ref_adj_value.csv","eez2015/layers/le_rev_ref_adj_value.csv"
"LE","le_rev_ref_base_value","Reference revenue base","Modeled LE data","value","value","../ohiprep/globalprep/le/v2013/data/le_2013_status_model_curref_rev_ref_base_value.csv",TRUE,"le_rev_ref_base_value.csv","eez2015/layers/le_rev_ref_base_value.csv"
"LE","le_rev_sector_year","Revenue","Modeled LE data","value","2010 USD","../ohiprep/globalprep/le/v2013/data/le_eez2013_trend_rev_sector-year.csv",TRUE,"le_rev_sector_year.csv","eez2015/layers/le_rev_sector_year.csv"
"LE","le_unemployment","Unemployment","Modeled LE data","percent","proportion","../ohiprep/globalprep/le/v2013/data/le_unemployment.csv",TRUE,"le_unemployment.csv","eez2015/layers/le_unemployment.csv"
"LE","le_wage_cur_adj_value","Current wages adjusted","Modeled LE data","value","value","../ohiprep/globalprep/le/v2013/data/le_2013_status_model_curref_wage_cur_adj_value.csv",TRUE,"le_wage_cur_adj_value.csv","eez2015/layers/le_wage_cur_adj_value.csv"
"LE","le_wage_cur_base_value","Current wages base","Modeled LE data","value","value","../ohiprep/globalprep/le/v2013/data/le_2013_status_model_curref_wage_cur_base_value.csv",TRUE,"le_wage_cur_base_value.csv","eez2015/layers/le_wage_cur_base_value.csv"
"LE","le_wage_ref_adj_value","Reference wages adjusted","Modeled LE data","value","value","../ohiprep/globalprep/le/v2013/data/le_2013_status_model_curref_wage_ref_adj_value.csv",TRUE,"le_wage_ref_adj_value.csv","eez2015/layers/le_wage_ref_adj_value.csv"
"LE","le_wage_ref_base_value","Reference wages base","Modeled LE data","value","value","../ohiprep/globalprep/le/v2013/data/le_2013_status_model_curref_wage_ref_base_value.csv",TRUE,"le_wage_ref_base_value.csv","eez2015/layers/le_wage_ref_base_value.csv"
"LE","le_wage_sector_year","Wages","Modeled LE data","value","2010 USD","../ohiprep/globalprep/le/v2013/data/le_eez2013_trend_wage_sector-year.csv",TRUE,"le_wage_sector_year.csv","eez2015/layers/le_wage_sector_year.csv"
"LE","le_workforcesize_adj","Adjusted workforce size","Modeled LE data","jobs","number of jobs","../ohiprep/globalprep/le_world_bank/v2014/data/cntry_wb_tlf_2014a_ratio-gapfilled.csv",TRUE,"le_workforcesize_adj.csv","eez2015/layers/le_workforcesize_adj.csv"
"LE pressures","le_sector_weight","Sector weight by jobs","Proportion of jobs within each sector","weight","value","../ohiprep/globalprep/le/v2015/data/le_sector_weight.csv",TRUE,"le_sector_weight.csv","eez2015/layers/le_sector_weight.csv"
"LSP","lsp_prot_area_inland1km","Inland coastal protected areas","Protected areas located 1 km inland","a_prot_1km","km2","../ohiprep/globalprep/lsp/v2016/output/lsp_protected_inland1km.csv",TRUE,"lsp_prot_area_inland1km.csv","eez2015/layers/lsp_prot_area_inland1km.csv"
"LSP","lsp_prot_area_offshore3nm","Offshore coastal protected areas","Protected areas located 3nm offshore","a_prot_3nm","km2","../ohiprep/globalprep/lsp/v2016/output/lsp_protected_offshore3nm.csv",TRUE,"lsp_prot_area_offshore3nm.csv","eez2015/layers/lsp_prot_area_offshore3nm.csv"
"LSP","rgn_area_inland1km","Inland area","Inland area of OHI regions within 1km of shoreline","area","km2","../ohiprep/globalprep/lsp/v2016/output/rgn_area_inland1km.csv",TRUE,"rgn_area_inland1km.csv","eez2015/layers/rgn_area_inland1km.csv"
"LSP","rgn_area_offshore3nm","Offshore area","Offshore area of OHI regions within 3nm of shoreline","area","km2","../ohiprep/globalprep/lsp/v2016/output/rgn_area_offshore3nm.csv",TRUE,"rgn_area_offshore3nm.csv","eez2015/layers/rgn_area_offshore3nm.csv"
"MAR","mar_coastalpopn_inland25mi","Inland coastal population","Total coastal population within 25 miles of coast.","popsum","number of people","../ohiprep/globalprep/mar_prs_population/v2016/output/mar_pop_25mi.csv",TRUE,"mar_coastalpopn_inland25mi.csv","eez2015/layers/mar_coastalpopn_inland25mi.csv"
"MAR","mar_harvest_tonnes","Mariculture harvest","Tonnes of mariculture harvest","tonnes","tonnes","../ohiprep/globalprep/mar/v2016/output//mar_harvest_tonnes.csv",TRUE,"mar_harvest_tonnes.csv","eez2015/layers/mar_harvest_tonnes.csv"
"MAR","mar_sustainability_score","Mariculture sustainability score","Mariculture sustainability from the Mariculture Sustainability Index (MSI).","sust_coeff","score","../ohiprep/globalprep/mar/v2016/output//mar_sustainability.csv",TRUE,"mar_sustainability_score.csv","eez2015/layers/mar_sustainability_score.csv"
"NP","np_blast","Areas of blast fishing","Destructive artisanal blast fishing","score","score","../ohiprep/globalprep/np_prs_poison_blast_fishing/v2013/data/gl_thr_blast_3nm_rgn2013.csv",TRUE,"np_blast.csv","eez2015/layers/np_blast.csv"
"NP","np_cyanide","Areas of poison fishing","Destructive artisanal poison (cyanide) fishing","score","score","../ohiprep/globalprep/np_prs_poison_blast_fishing/v2013/data/gl_thr_poison_3nm_rgn2013.csv",TRUE,"np_cyanide.csv","eez2015/layers/np_cyanide.csv"
"NP","np_harvest_product_weight","Relative harvest value","Value of harvest of each product relative to total harvest of six marine products (coral, fish oil, seaweed and plants, shells, sponges, ornamental fish). Used to weight contribution of each product to final score.","weight","proportion","../ohiprep/globalprep/np/v2016/output/np_harvest_weights_from_usd.csv",TRUE,"np_harvest_product_weight.csv","eez2015/layers/np_harvest_product_weight.csv"
"NP","np_harvest_tonnes","Natural product harvest","Yield in metric tonnes of six marine products (coral, fish oil, seaweed and plants, shells, sponges, ornamental fish) from FAO","tonnes","tonnes","../ohiprep/globalprep/np/v2016/output/np_harvest_tonnes.csv",TRUE,"np_harvest_tonnes.csv","eez2015/layers/np_harvest_tonnes.csv"
"NP","np_harvest_tonnes_relative","Relative harvest tonnes","Tonnes of harvest of each product relative to total harvest of six marine products (coral, fish oil, seaweed and plants, shells, sponges, ornamental fish). Used to weight contribution of each product to final score.","tonnes_rel","proportion","../ohiprep/globalprep/np/v2016/output/np_harvest_tonnes_rel.csv",TRUE,"np_harvest_tonnes_relative.csv","eez2015/layers/np_harvest_tonnes_relative.csv"
"pressures","cc_acid","Ocean acidification","Ocean acidification pressure scaled using biological thresholds","pressure_score","scaled 0-1","../ohiprep/globalprep/prs_oa/v2016/output/acid_eez_2014.csv",TRUE,"cc_acid.csv","eez2015/layers/cc_acid.csv"
"pressures","cc_slr","Sea level rise","Sea level rise pressure","pressure_score","scaled 0-1","../ohiprep/globalprep/prs_slr/v2016/output/slr_2015.csv",TRUE,"cc_slr.csv","eez2015/layers/cc_slr.csv"
"pressures","cc_sst","Sea surface temperature anomolies","Sea surface temperature anomolies","pressure_score","scaled 0-1","../ohiprep/globalprep/prs_sst/v2016/output/sst_2015.csv",TRUE,"cc_sst.csv","eez2015/layers/cc_sst.csv"
"pressures","cc_uv","UV radiation pressure","Modeled UV radiation based on Erythemal UV Irradiance data provided by GES DISC.","pressure_score","scaled 0-1","../ohiprep/globalprep/prs_uv/v2016/output/uv_2015.csv",TRUE,"cc_uv.csv","eez2015/layers/cc_uv.csv"
"pressures","fp_art_hb","High bycatch due to artisanal fishing ","The presence of destructive artisanal blast and poison (cyanide) fishing.","pressure_score","scaled 0-1","../ohiprep/globalprep/np_prs_poison_blast_fishing/v2013/data/blast_poison_3nm.csv",TRUE,"fp_art_hb.csv","eez2015/layers/fp_art_hb.csv"
"pressures","fp_art_lb","Low bycatch due to artisanal fishing ","Artisanal fishing using non-destructive practices","pressure_score","scaled 0-1","../ohiprep/globalprep/prs_fish/v2016/output/artisanal_fish_lb_2015.csv",TRUE,"fp_art_lb.csv","eez2015/layers/fp_art_lb.csv"
"pressures","fp_com_hb","High bycatch due to commercial fishing ","Modeled destructive commercial fishing practices by 5 gear types","pressure_score","scaled 0-1","../ohiprep/globalprep/prs_fish/v2016/output/comm_fish_hb_2015.csv",TRUE,"fp_com_hb.csv","eez2015/layers/fp_com_hb.csv"
"pressures","fp_com_lb","Low bycatch due to commercial fishing ","Modeled destructive commercial fishing practices by 2 gear types","pressure_score","scaled 0-1","../ohiprep/globalprep/prs_fish/v2016/output/comm_fish_lb_2015.csv",TRUE,"fp_com_lb.csv","eez2015/layers/fp_com_lb.csv"
"pressures","fp_targetharvest","Targeted harvest of cetaceans and marine turtles","Targeted harvest of cetaceans and marine turtles","pressure_score","scaled 0-1","../ohiprep/globalprep/prs_targetedharvest/v2016/output/fao_targeted_2015.csv",TRUE,"fp_targetharvest.csv","eez2015/layers/fp_targetharvest.csv"
"pressures","hd_intertidal","Intertidal habitat destruction","Coastal population density as a proxy for intertidal habitat destruction","pressure_score","scaled 0-1","../ohiprep/globalprep/mar_prs_population/v2016/output/prs_pop_density_2015.csv",TRUE,"hd_intertidal.csv","eez2015/layers/hd_intertidal.csv"
"pressures","hd_subtidal_hb","Subtidal hardbottom habitat destruction","High bycatch artisanal fishing practices (blast fishing) as a proxy for subtidal hard bottom habitat destruction","score","scaled 0-1","../ohiprep/globalprep/np_prs_poison_blast_fishing/v2013/data/gl_thr_blast_3nm_rgn2013.csv",TRUE,"hd_subtidal_hb.csv","eez2015/layers/hd_subtidal_hb.csv"
"pressures","hd_subtidal_sb","Subtidal softbottom habitat destruction","Demersal destructive commercial fishing practices in softbottom habitat as a proxy for soft bottom habitat destruction","pressure_score","scaled 0-1","../ohiprep/globalprep/prs_hd_subtidal_soft_bottom/v2016/output/hd_sb_subtidal_2015.csv",TRUE,"hd_subtidal_sb.csv","eez2015/layers/hd_subtidal_sb.csv"
"pressures","po_chemicals","Chemical pollution","Modeled chemical pollution from commercial shipping traffic, ports and harbors, and pesticide use","pressure_score","scaled 0-1","../ohiprep/globalprep/prs_chem/v2015/output/cw_chemical_score_2015.csv",TRUE,"po_chemicals.csv","eez2015/layers/po_chemicals.csv"
"pressures","po_nutrients","Nutrient pollution","Modeled data based on fertilizer consumption from the Food and Agricultural Organization","pressure_score","scaled 0-1","../ohiprep/globalprep/prs_land-based_nutrient/v2015/output/cw_fertilizers_score_2015.csv",TRUE,"po_nutrients.csv","eez2015/layers/po_nutrients.csv"
"pressures","sp_alien","Nonindigenous species","The number and type of invasive and harmful invasive species in each marine ecoregion","pressures.score","scaled 0-1","../ohiprep/globalprep/prs_alien/v2013/data/p_sp_alien_2013a.csv",TRUE,"sp_alien.csv","eez2015/layers/sp_alien.csv"
"pressures","sp_genetic","Genetic escapes","Introduced mariculture species (Mariculture Sustainability Index) as a proxy for genetic escapes ","pressure_score","scaled 0-1","../ohiprep/globalprep/mar/v2016/output/GenEsc_v2015.csv",TRUE,"sp_genetic.csv","eez2015/layers/sp_genetic.csv"
"pressures","ss_spi","Weakness of social progress","Inverse of Social Progress Index scores","pressure_score","scaled 0-1","../ohiprep/globalprep/prs_res_spi/v2016/output/spi_prs.csv",TRUE,"ss_spi.csv","eez2015/layers/ss_spi.csv"
"pressures","ss_wgi","Weakness of governance","Inverse of World Governance Indicators (WGI) six combined scores","pressure_score","scaled 0-1","../ohiprep/globalprep/prs_res_wgi/v2016/output/wgi_prs_2015.csv",TRUE,"ss_wgi.csv","eez2015/layers/ss_wgi.csv"
"pressures resilience","element_wts_cp_km2_x_protection","Coastal protection weights","Habitat extent multiplied by habitat protection rank for: coral, mangrove (offshore and inland 1km), saltmarsh, sea ice (shoreline), and seagrass","extent_rank","extent*rank","../ohiprep/globalprep/hab_combined/v2015/data/cp_habitat_extent_rank.csv",TRUE,"element_wts_cp_km2_x_protection.csv","eez2015/layers/element_wts_cp_km2_x_protection.csv"
"pressures resilience","element_wts_cs_km2_x_storage","Carbon storage weights","Habitat extent multiplied by carbon storage capacity for:  mangrove (offshore and inland 1km), saltmarsh, and sea ice","extent_rank","extent*storage","../ohiprep/globalprep/hab_combined/v2015/data/cs_habitat_extent_rank.csv",TRUE,"element_wts_cs_km2_x_storage.csv","eez2015/layers/element_wts_cs_km2_x_storage.csv"
"pressures resilience","element_wts_hab_pres_abs","Habitat weights","List of habitats in each region","boolean","boolean","../ohiprep/globalprep/hab_combined/v2015/data/hab_habitat_presence.csv",TRUE,"element_wts_hab_pres_abs.csv","eez2015/layers/element_wts_hab_pres_abs.csv"
"resilience","fp_habitat","Management and protection of habitat to preserve biodiversity (fisheries)","Survey responses by country to the Convention on Biologicial Diversity (CBD) Third National Report: habitat related questions","resilience score","scaled 0-1","../ohiprep/globalprep/res_cbd_habitat/v2014/data/r_habitat_2013a.csv",TRUE,"fp_habitat.csv","eez2015/layers/fp_habitat.csv"
"resilience","fp_mora","Commercial fishing management","Regulations and management of commerical fishing","value","scaled 0-1","../ohiprep/globalprep/res_mora_ao/v2013/data/r_mora_2013a.csv",TRUE,"fp_mora.csv","eez2015/layers/fp_mora.csv"
"resilience","fp_mora_artisanal","Artisanal fishing management","Regulations and management of artisanal fishing","value","scaled 0-1","../ohiprep/globalprep/res_mora_ao/v2013/data/r_mora_s4_2013a.csv",TRUE,"fp_mora_artisanal.csv","eez2015/layers/fp_mora_artisanal.csv"
"resilience","fp_mpa_coast","Coastal protected marine areas to protect fishery resources","Protected marine areas within 3nm of coastline (lasting special places goal calculated for coastal zone)","resilience.score","scaled 0-1","../ohiprep/globalprep/lsp/v2016/output/mpa_3nm_2014.csv",TRUE,"fp_mpa_coast.csv","eez2015/layers/fp_mpa_coast.csv"
"resilience","fp_mpa_eez","EEZ protected marine areas to protect fishery resources","Protected marine areas within EEZ to protect fishery resource (lasting special places goal results)","resilience.score","scaled 0-1","../ohiprep/globalprep/lsp/v2016/output/mpa_eez_2014_resilience.csv",TRUE,"fp_mpa_eez.csv","eez2015/layers/fp_mpa_eez.csv"
"resilience","g_cites","Resilience from commitment to CITES","Convention on International Trade in Endangered Species of Wild Fauna and Flora (CITES) signatories","resilience_score","scaled 0-1","../ohiprep/globalprep/res_cites_signatories/v2015/data/rgn_cites_eez2015.csv",TRUE,"g_cites.csv","eez2015/layers/g_cites.csv"
"resilience","g_mariculture","Management of mariculture practices to preserve biodiversity","Survey responses by country to the Convention on Biologicial Diversity (CBD) Third National Report: mariculture related questions","resilience score","scaled 0-1","../ohiprep/globalprep/res_cbd_habitat/v2014/data/r_mariculture_2013a.csv",TRUE,"g_mariculture.csv","eez2015/layers/g_mariculture.csv"
"resilience","g_msi_gov","Mariculture Sustainability Index","Mariculture practice assessment criteria from the Mariculture Sustainability Index (MSI)","resilience score","scaled 0-1","../ohiprep//globalprep/res_mariculture_sustainability/v2013/r_msi_gov_2013a.csv",TRUE,"g_msi_gov.csv","eez2015/layers/g_msi_gov.csv"
"resilience","g_tourism","Management of tourism to preserve biodiversity","Survey responses by country to the Convention on Biologicial Diversity (CBD) Third National Report: tourism related questions","resilience score","scaled 0-1","../ohiprep/globalprep/res_cbd_habitat/v2014/data/r_tourism_2013a.csv",TRUE,"g_tourism.csv","eez2015/layers/g_tourism.csv"
"resilience","hd_habitat","Management and protection of habitat to preserve biodiversity","Survey responses by country to the Convention on Biologicial Diversity (CBD) Third National Report: habitat related questions","resilience score","scaled 0-1","../ohiprep/globalprep/res_cbd_habitat/v2014/data/r_habitat_2013a.csv",TRUE,"hd_habitat.csv","eez2015/layers/hd_habitat.csv"
"resilience","hd_mpa_coast","Coastal protected marine areas to protect against habitat destruction","Protected marine areas within 3nm of coastline (lasting special places goal calculated for coastal zone)","resilience.score","scaled 0-1","../ohiprep/globalprep/lsp/v2016/output/mpa_3nm_2014.csv",TRUE,"hd_mpa_coast.csv","eez2015/layers/hd_mpa_coast.csv"
"resilience","hd_mpa_eez","Protected marine areas within EEZ to protect against habitat destruction","Protected marine areas within EEZ (lasting special places goal results)","resilience.score","scaled 0-1","../ohiprep/globalprep/lsp/v2016/output/mpa_eez_2014_resilience.csv",TRUE,"hd_mpa_eez.csv","eez2015/layers/hd_mpa_eez.csv"
"resilience","li_gci","Competitiveness in achieving sustained economic prosperity","Global Competitiveness Index (GCI) scores from the World Economic Forum","score","scaled","../ohiprep/globalprep/res_gci/v2015/data/rgn_wef_gci_2015.csv",TRUE,"li_gci.csv","eez2015/layers/li_gci.csv"
"resilience","li_sector_evenness","Sector evenness as a measure of economic diversity","Shannon's Diversity Index calculated sector evenness based on the total number of sectors and the proportion of jobs belonging to any sector","resilience score","scaled","../ohiprep/globalprep/res_li_sector_evenness/v2013/r_li_sector_evenness_2013a.csv",TRUE,"li_sector_evenness.csv","eez2015/layers/li_sector_evenness.csv"
"resilience","po_water","Management and regulations to control water pollution to preserve biodiversity","Survey responses by country to the Convention on Biologicial Diversity (CBD) Third National Report: tourism related questions","resilience score","scaled 0-1","../ohiprep/globalprep/res_cbd_habitat/v2014/data/r_water_2013a.csv",TRUE,"po_water.csv","eez2015/layers/po_water.csv"
"resilience","res_spi","Social Progress Index","Social Progress Index scores","resilience_score","scaled 0-1","../ohiprep/globalprep/prs_res_spi/v2016/output/spi_res.csv",TRUE,"res_spi.csv","eez2015/layers/res_spi.csv"
"resilience","sp_alien_species","Management of nonindigenous species","Survey responses by country to the Convention on Biologicial Diversity (CBD) Third National Report: invasive species related questions","resilience score","scaled 0-1","../ohiprep/globalprep/res_cbd_habitat/v2014/data/r_alien_species_Nature2012disaggregated.csv",TRUE,"sp_alien_species.csv","eez2015/layers/sp_alien_species.csv"
